-----> DML COMMANDS:- 
DATA MANIPULATION LANGUAGE:-



INSERT:-
---- AP-1
SYNTAX:- insert into table-name(column-name,column-name2,....column-name n)
values(value-1,value2,value3........value n);

insert into employees values()

---> UPDATE:-
----
Update table-name set column-name=value where some condition;

---> DELETE:- DELETE THE RECORDS BASED ON SOME CONDITION
--- SYNTAX:-
--- delete from table-name where some-condition.

--->TRUNCATE
--- Removes all records present in a table
SYNTAX:-
truncate table table-name;


---> drop deletes entire table structure and records whereas
---> truncate delete only records and doesn't affect the table structure




1. DROP
--- DEFINITION:- removes the table or object
1. table structure + data
2. table structure removed
3. performance is slow(due to full removal)

2. DELETE
DEFINITION:- removes specific rows from a table
1. specific rows(based on condition)
2. table structure intact
3. performance is slower (row-by-row)

3.TRUNCATE
DEFINITION:- removes all rows, keeps structure
1. all rows
2. table structure intact
3. performance is fast(bulk deletion)



https://github.com/mallikharjuna2000/mysqlqueries



Enter password: **********
Welcome to the MySQL monitor.  Commands end with ; or \g.
Your MySQL connection id is 22
Server version: 8.0.46 MySQL Community Server - GPL

Copyright (c) 2000, 2026, Oracle and/or its affiliates.

Oracle is a registered trademark of Oracle Corporation and/or its
affiliates. Other names may be trademarks of their respective
owners.

Type 'help;' or '\h' for help. Type '\c' to clear the current input statement.

mysql> USE PFS6;
Database changed
mysql> SHOW TABLES;
+----------------+
| Tables_in_pfs6 |
+----------------+
| company_staff  |
+----------------+
1 row in set (0.01 sec)

mysql> CREATE TABLE EMPLOYEES(
    -> EMPID CHAR(5) PRIMARY KEY,
    -> FIRSTNAME VARCHAR(50),
    -> LASTNAME VARCHAR(30),
    -> AGE INT,
    -> DOJ DATE,
    -> ADDRESS TINYTEXT,
    -> DEPT VARCHAR(20)
    -> );
Query OK, 0 rows affected (0.13 sec)

mysql> INSERT INTO EMPLOYEES(EMPID,FIRSTNAME,LASTNAME,AGE,DOJ,ADDRESS,DEPT)
    -> VALUES
    -> ('E0001','ARJUN','SARKAR',27,'2024-03-20','HYD','TRAINING');
Query OK, 1 row affected (0.08 sec)

mysql> SELECT*FROM EMPLOYEES;
+-------+-----------+----------+------+------------+---------+----------+
| EMPID | FIRSTNAME | LASTNAME | AGE  | DOJ        | ADDRESS | DEPT     |
+-------+-----------+----------+------+------------+---------+----------+
| E0001 | ARJUN     | SARKAR   |   27 | 2024-03-20 | HYD     | TRAINING |
+-------+-----------+----------+------+------------+---------+----------+
1 row in set (0.00 sec)

mysql> INSERT INTO EMPLOYEES(EMPID,FIRSTNAME,LASTNAME,AGE,DOJ,ADDRESS,DEPT)
    -> VALUES
    -> ('E0003','SUNNY','LEONE',35,'2000-03-20','MUMBAI','ACTING'),
    -> ('E0004','SUMPURNESH','BABU',40,'2016-09-10','HYD','ACTING');
Query OK, 2 rows affected (0.08 sec)
Records: 2  Duplicates: 0  Warnings: 0

mysql> SELECT*FROM EMPLOYEES;
+-------+------------+----------+------+------------+---------+----------+
| EMPID | FIRSTNAME  | LASTNAME | AGE  | DOJ        | ADDRESS | DEPT     |
+-------+------------+----------+------+------------+---------+----------+
| E0001 | ARJUN      | SARKAR   |   27 | 2024-03-20 | HYD     | TRAINING |
| E0003 | SUNNY      | LEONE    |   35 | 2000-03-20 | MUMBAI  | ACTING   |
| E0004 | SUMPURNESH | BABU     |   40 | 2016-09-10 | HYD     | ACTING   |
+-------+------------+----------+------+------------+---------+----------+
3 rows in set (0.00 sec)

mysql> INSERT INTO EMPLOYEES VALUES('E0005','JANI','BASHA',25,'2026-02-2017','VJY',PHARMA');
    '> ^C
mysql> INSERT INTO EMPLOYEES VALUES('E0005','JANI','BASHA',25,'2026-02-2017','VJY','PHARMA');
ERROR 1292 (22007): Incorrect date value: '2026-02-2017' for column 'DOJ' at row 1
mysql> ^C
mysql> INSERT INTO EMPLOYEES VALUES('E0005','JANI','BASHA',25,'2026-02-17','VJY','PHARMA');
Query OK, 1 row affected (0.08 sec)

mysql> INSERT INTO EMPLOYEES
    -> VALUES
    -> ('E0006','SAI','VARDAN',24,'2024-03-18','VSP','TRAINING'),
    -> ('E0007','SAI','KIRAN',32,'2018-08-20','BNG','ADMIN');
Query OK, 2 rows affected (0.08 sec)
Records: 2  Duplicates: 0  Warnings: 0

mysql> SELECT*FROM EMPLOYEES;
+-------+------------+----------+------+------------+---------+----------+
| EMPID | FIRSTNAME  | LASTNAME | AGE  | DOJ        | ADDRESS | DEPT     |
+-------+------------+----------+------+------------+---------+----------+
| E0001 | ARJUN      | SARKAR   |   27 | 2024-03-20 | HYD     | TRAINING |
| E0003 | SUNNY      | LEONE    |   35 | 2000-03-20 | MUMBAI  | ACTING   |
| E0004 | SUMPURNESH | BABU     |   40 | 2016-09-10 | HYD     | ACTING   |
| E0005 | JANI       | BASHA    |   25 | 2026-02-17 | VJY     | PHARMA   |
| E0006 | SAI        | VARDAN   |   24 | 2024-03-18 | VSP     | TRAINING |
| E0007 | SAI        | KIRAN    |   32 | 2018-08-20 | BNG     | ADMIN    |
+-------+------------+----------+------+------------+---------+----------+
6 rows in set (0.00 sec)

mysql> INSERT INTO EMPLOYEES(DOJ,DEPT,ADDRESS,EMPID,FIRSTNAME,LASTNAME,AGE)
    -> VALUES
    -> ('2000-07-27','SALES','DELHI','E0008','BALU','SUBBU',40);
Query OK, 1 row affected (0.07 sec)

mysql> SELECT*FROM EMPLOYEES;
+-------+------------+----------+------+------------+---------+----------+
| EMPID | FIRSTNAME  | LASTNAME | AGE  | DOJ        | ADDRESS | DEPT     |
+-------+------------+----------+------+------------+---------+----------+
| E0001 | ARJUN      | SARKAR   |   27 | 2024-03-20 | HYD     | TRAINING |
| E0003 | SUNNY      | LEONE    |   35 | 2000-03-20 | MUMBAI  | ACTING   |
| E0004 | SUMPURNESH | BABU     |   40 | 2016-09-10 | HYD     | ACTING   |
| E0005 | JANI       | BASHA    |   25 | 2026-02-17 | VJY     | PHARMA   |
| E0006 | SAI        | VARDAN   |   24 | 2024-03-18 | VSP     | TRAINING |
| E0007 | SAI        | KIRAN    |   32 | 2018-08-20 | BNG     | ADMIN    |
| E0008 | BALU       | SUBBU    |   40 | 2000-07-27 | DELHI   | SALES    |
+-------+------------+----------+------+------------+---------+----------+
7 rows in set (0.00 sec)

mysql> INSERT INTO EMPLOYEES(EMPID,FIRSTNAME,AGE,ADDRESS,DEPT)
    -> VALUES
    -> 'E0009','HARI',17,'NOIDA','HR');
ERROR 1064 (42000): You have an error in your SQL syntax; check the manual that corresponds to your MySQL server version for the right syntax to use near ''E0009','HARI',17,'NOIDA','HR')' at line 3
mysql> ^C
mysql> ('E0009','HARI',17,'NOIDA','HR');
ERROR 1064 (42000): You have an error in your SQL syntax; check the manual that corresponds to your MySQL server version for the right syntax to use near ''E0009','HARI',17,'NOIDA','HR')' at line 1
mysql> ^C
mysql> ('E0009','HARI',17,'NOIDA','HR');
ERROR 1064 (42000): You have an error in your SQL syntax; check the manual that corresponds to your MySQL server version for the right syntax to use near ''E0009','HARI',17,'NOIDA','HR')' at line 1
mysql> ^C
mysql> ('E0009','HARI',17,'NOIDA','HR');^C
mysql> INSERT INTO EMPLOYEES(EMPID,FIRSTNAME,AGE,ADDRESS,DEPT)
    -> VALUES
    -> ('E0009','HARI',17,'NOIDA','HR');
Query OK, 1 row affected (0.01 sec)

mysql> SELECT*FROM EMPLOYEES;
+-------+------------+----------+------+------------+---------+----------+
| EMPID | FIRSTNAME  | LASTNAME | AGE  | DOJ        | ADDRESS | DEPT     |
+-------+------------+----------+------+------------+---------+----------+
| E0001 | ARJUN      | SARKAR   |   27 | 2024-03-20 | HYD     | TRAINING |
| E0003 | SUNNY      | LEONE    |   35 | 2000-03-20 | MUMBAI  | ACTING   |
| E0004 | SUMPURNESH | BABU     |   40 | 2016-09-10 | HYD     | ACTING   |
| E0005 | JANI       | BASHA    |   25 | 2026-02-17 | VJY     | PHARMA   |
| E0006 | SAI        | VARDAN   |   24 | 2024-03-18 | VSP     | TRAINING |
| E0007 | SAI        | KIRAN    |   32 | 2018-08-20 | BNG     | ADMIN    |
| E0008 | BALU       | SUBBU    |   40 | 2000-07-27 | DELHI   | SALES    |
| E0009 | HARI       | NULL     |   17 | NULL       | NOIDA   | HR       |
+-------+------------+----------+------+------------+---------+----------+
8 rows in set (0.00 sec)

mysql> INSERT INTO EMPLOYEES(EMPID,LASTNAME,DOJ,DEPT)
    -> VALUES
    -> ('E0002','BABU','2026-03-03','IT');
Query OK, 1 row affected (0.07 sec)

mysql> SELECT*FROM EMPLOYEES;
+-------+------------+----------+------+------------+---------+----------+
| EMPID | FIRSTNAME  | LASTNAME | AGE  | DOJ        | ADDRESS | DEPT     |
+-------+------------+----------+------+------------+---------+----------+
| E0001 | ARJUN      | SARKAR   |   27 | 2024-03-20 | HYD     | TRAINING |
| E0002 | NULL       | BABU     | NULL | 2026-03-03 | NULL    | IT       |
| E0003 | SUNNY      | LEONE    |   35 | 2000-03-20 | MUMBAI  | ACTING   |
| E0004 | SUMPURNESH | BABU     |   40 | 2016-09-10 | HYD     | ACTING   |
| E0005 | JANI       | BASHA    |   25 | 2026-02-17 | VJY     | PHARMA   |
| E0006 | SAI        | VARDAN   |   24 | 2024-03-18 | VSP     | TRAINING |
| E0007 | SAI        | KIRAN    |   32 | 2018-08-20 | BNG     | ADMIN    |
| E0008 | BALU       | SUBBU    |   40 | 2000-07-27 | DELHI   | SALES    |
| E0009 | HARI       | NULL     |   17 | NULL       | NOIDA   | HR       |
+-------+------------+----------+------+------------+---------+----------+
9 rows in set (0.00 sec)

mysql> UPDATE EMPLOYEES SET FIRSTNAME='KATRINA'WHERE EMPID='E0003';
Query OK, 1 row affected (0.07 sec)
Rows matched: 1  Changed: 1  Warnings: 0

mysql> SELECT*FROM EMPLOYEES WHERE EMPID='E0003';
+-------+-----------+----------+------+------------+---------+--------+
| EMPID | FIRSTNAME | LASTNAME | AGE  | DOJ        | ADDRESS | DEPT   |
+-------+-----------+----------+------+------------+---------+--------+
| E0003 | KATRINA   | LEONE    |   35 | 2000-03-20 | MUMBAI  | ACTING |
+-------+-----------+----------+------+------------+---------+--------+
1 row in set (0.00 sec)

mysql> UPDATE EMPLOYEES SET FIRSTNAME='MAHESH'WHERE LASTNAME 'BABU';
ERROR 1064 (42000): You have an error in your SQL syntax; check the manual that corresponds to your MySQL server version for the right syntax to use near ''BABU'' at line 1
mysql> ^C
mysql> UPDATE EMPLOYEES SET LASTNAME='MAHESH' WHERE LASTNAME='BABU';
Query OK, 2 rows affected (0.07 sec)
Rows matched: 2  Changed: 2  Warnings: 0

mysql> SELECT*FROM EMPLOYEES;
+-------+------------+----------+------+------------+---------+----------+
| EMPID | FIRSTNAME  | LASTNAME | AGE  | DOJ        | ADDRESS | DEPT     |
+-------+------------+----------+------+------------+---------+----------+
| E0001 | ARJUN      | SARKAR   |   27 | 2024-03-20 | HYD     | TRAINING |
| E0002 | NULL       | MAHESH   | NULL | 2026-03-03 | NULL    | IT       |
| E0003 | KATRINA    | LEONE    |   35 | 2000-03-20 | MUMBAI  | ACTING   |
| E0004 | SUMPURNESH | MAHESH   |   40 | 2016-09-10 | HYD     | ACTING   |
| E0005 | JANI       | BASHA    |   25 | 2026-02-17 | VJY     | PHARMA   |
| E0006 | SAI        | VARDAN   |   24 | 2024-03-18 | VSP     | TRAINING |
| E0007 | SAI        | KIRAN    |   32 | 2018-08-20 | BNG     | ADMIN    |
| E0008 | BALU       | SUBBU    |   40 | 2000-07-27 | DELHI   | SALES    |
| E0009 | HARI       | NULL     |   17 | NULL       | NOIDA   | HR       |
+-------+------------+----------+------+------------+---------+----------+
9 rows in set (0.00 sec)

mysql> UPDATE EMPLOYEES SET AGE=50 WHERE AGE IS NULL;
Query OK, 1 row affected (0.07 sec)
Rows matched: 1  Changed: 1  Warnings: 0

mysql> SELECT*FROM EMPLOYEES;
+-------+------------+----------+------+------------+---------+----------+
| EMPID | FIRSTNAME  | LASTNAME | AGE  | DOJ        | ADDRESS | DEPT     |
+-------+------------+----------+------+------------+---------+----------+
| E0001 | ARJUN      | SARKAR   |   27 | 2024-03-20 | HYD     | TRAINING |
| E0002 | NULL       | MAHESH   |   50 | 2026-03-03 | NULL    | IT       |
| E0003 | KATRINA    | LEONE    |   35 | 2000-03-20 | MUMBAI  | ACTING   |
| E0004 | SUMPURNESH | MAHESH   |   40 | 2016-09-10 | HYD     | ACTING   |
| E0005 | JANI       | BASHA    |   25 | 2026-02-17 | VJY     | PHARMA   |
| E0006 | SAI        | VARDAN   |   24 | 2024-03-18 | VSP     | TRAINING |
| E0007 | SAI        | KIRAN    |   32 | 2018-08-20 | BNG     | ADMIN    |
| E0008 | BALU       | SUBBU    |   40 | 2000-07-27 | DELHI   | SALES    |
| E0009 | HARI       | NULL     |   17 | NULL       | NOIDA   | HR       |
+-------+------------+----------+------+------------+---------+----------+
9 rows in set (0.00 sec)

mysql> UPDATE EMPLOYEES SET FIRSTNAME='HARI' WHERE LASTNAME='KRISHNA';
Query OK, 0 rows affected (0.00 sec)
Rows matched: 0  Changed: 0  Warnings: 0

mysql> SELECT*FROM EMPLOYEES;
+-------+------------+----------+------+------------+---------+----------+
| EMPID | FIRSTNAME  | LASTNAME | AGE  | DOJ        | ADDRESS | DEPT     |
+-------+------------+----------+------+------------+---------+----------+
| E0001 | ARJUN      | SARKAR   |   27 | 2024-03-20 | HYD     | TRAINING |
| E0002 | NULL       | MAHESH   |   50 | 2026-03-03 | NULL    | IT       |
| E0003 | KATRINA    | LEONE    |   35 | 2000-03-20 | MUMBAI  | ACTING   |
| E0004 | SUMPURNESH | MAHESH   |   40 | 2016-09-10 | HYD     | ACTING   |
| E0005 | JANI       | BASHA    |   25 | 2026-02-17 | VJY     | PHARMA   |
| E0006 | SAI        | VARDAN   |   24 | 2024-03-18 | VSP     | TRAINING |
| E0007 | SAI        | KIRAN    |   32 | 2018-08-20 | BNG     | ADMIN    |
| E0008 | BALU       | SUBBU    |   40 | 2000-07-27 | DELHI   | SALES    |
| E0009 | HARI       | NULL     |   17 | NULL       | NOIDA   | HR       |
+-------+------------+----------+------+------------+---------+----------+
9 rows in set (0.00 sec)

mysql> UPDATE EMPLOYEES SET LASTNAME='KRISHNA' WHERE FIRSTNAME='HARI;
    '> ^C
mysql> UPDATE EMPLOYEES SET LASTNAME='KRISHNA' WHERE FIRSTNAME='HARI';
Query OK, 1 row affected (0.07 sec)
Rows matched: 1  Changed: 1  Warnings: 0

mysql> SELECT*FROM EMPLOYEES;
+-------+------------+----------+------+------------+---------+----------+
| EMPID | FIRSTNAME  | LASTNAME | AGE  | DOJ        | ADDRESS | DEPT     |
+-------+------------+----------+------+------------+---------+----------+
| E0001 | ARJUN      | SARKAR   |   27 | 2024-03-20 | HYD     | TRAINING |
| E0002 | NULL       | MAHESH   |   50 | 2026-03-03 | NULL    | IT       |
| E0003 | KATRINA    | LEONE    |   35 | 2000-03-20 | MUMBAI  | ACTING   |
| E0004 | SUMPURNESH | MAHESH   |   40 | 2016-09-10 | HYD     | ACTING   |
| E0005 | JANI       | BASHA    |   25 | 2026-02-17 | VJY     | PHARMA   |
| E0006 | SAI        | VARDAN   |   24 | 2024-03-18 | VSP     | TRAINING |
| E0007 | SAI        | KIRAN    |   32 | 2018-08-20 | BNG     | ADMIN    |
| E0008 | BALU       | SUBBU    |   40 | 2000-07-27 | DELHI   | SALES    |
| E0009 | HARI       | KRISHNA  |   17 | NULL       | NOIDA   | HR       |
+-------+------------+----------+------+------------+---------+----------+
9 rows in set (0.00 sec)

mysql> UPDATE EMPLOYEES SET DOJ='2026-09-05' WHERE 'E0008';
ERROR 1292 (22007): Truncated incorrect DOUBLE value: 'E0008'
mysql> ^C
mysql> UPDATE EMPLOYEES SET DOJ='2026-09-05' WHERE 'E0009';
ERROR 1292 (22007): Truncated incorrect DOUBLE value: 'E0009'
mysql> ^C
mysql> UPDATE EMPLOYEES SET ADDRESS='CHENNAI' WHERE DEPT='IT';
Query OK, 1 row affected (0.01 sec)
Rows matched: 1  Changed: 1  Warnings: 0

mysql> SELECT*FROM EMPLOYEES;
+-------+------------+----------+------+------------+---------+----------+
| EMPID | FIRSTNAME  | LASTNAME | AGE  | DOJ        | ADDRESS | DEPT     |
+-------+------------+----------+------+------------+---------+----------+
| E0001 | ARJUN      | SARKAR   |   27 | 2024-03-20 | HYD     | TRAINING |
| E0002 | NULL       | MAHESH   |   50 | 2026-03-03 | CHENNAI | IT       |
| E0003 | KATRINA    | LEONE    |   35 | 2000-03-20 | MUMBAI  | ACTING   |
| E0004 | SUMPURNESH | MAHESH   |   40 | 2016-09-10 | HYD     | ACTING   |
| E0005 | JANI       | BASHA    |   25 | 2026-02-17 | VJY     | PHARMA   |
| E0006 | SAI        | VARDAN   |   24 | 2024-03-18 | VSP     | TRAINING |
| E0007 | SAI        | KIRAN    |   32 | 2018-08-20 | BNG     | ADMIN    |
| E0008 | BALU       | SUBBU    |   40 | 2000-07-27 | DELHI   | SALES    |
| E0009 | HARI       | KRISHNA  |   17 | NULL       | NOIDA   | HR       |
+-------+------------+----------+------+------------+---------+----------+
9 rows in set (0.00 sec)

mysql> UPDATE EMPLOYEES SET DOJ='2026-09-05' WHERE EMPID='E0009';
Query OK, 1 row affected (0.01 sec)
Rows matched: 1  Changed: 1  Warnings: 0

mysql> SELECT*FROM EMPLOYEES;
+-------+------------+----------+------+------------+---------+----------+
| EMPID | FIRSTNAME  | LASTNAME | AGE  | DOJ        | ADDRESS | DEPT     |
+-------+------------+----------+------+------------+---------+----------+
| E0001 | ARJUN      | SARKAR   |   27 | 2024-03-20 | HYD     | TRAINING |
| E0002 | NULL       | MAHESH   |   50 | 2026-03-03 | CHENNAI | IT       |
| E0003 | KATRINA    | LEONE    |   35 | 2000-03-20 | MUMBAI  | ACTING   |
| E0004 | SUMPURNESH | MAHESH   |   40 | 2016-09-10 | HYD     | ACTING   |
| E0005 | JANI       | BASHA    |   25 | 2026-02-17 | VJY     | PHARMA   |
| E0006 | SAI        | VARDAN   |   24 | 2024-03-18 | VSP     | TRAINING |
| E0007 | SAI        | KIRAN    |   32 | 2018-08-20 | BNG     | ADMIN    |
| E0008 | BALU       | SUBBU    |   40 | 2000-07-27 | DELHI   | SALES    |
| E0009 | HARI       | KRISHNA  |   17 | 2026-09-05 | NOIDA   | HR       |
+-------+------------+----------+------+------------+---------+----------+
9 rows in set (0.00 sec)

mysql> delete from employees where empid='e0009';
Query OK, 1 row affected (0.07 sec)

mysql> select*from employees;
+-------+------------+----------+------+------------+---------+----------+
| EMPID | FIRSTNAME  | LASTNAME | AGE  | DOJ        | ADDRESS | DEPT     |
+-------+------------+----------+------+------------+---------+----------+
| E0001 | ARJUN      | SARKAR   |   27 | 2024-03-20 | HYD     | TRAINING |
| E0002 | NULL       | MAHESH   |   50 | 2026-03-03 | CHENNAI | IT       |
| E0003 | KATRINA    | LEONE    |   35 | 2000-03-20 | MUMBAI  | ACTING   |
| E0004 | SUMPURNESH | MAHESH   |   40 | 2016-09-10 | HYD     | ACTING   |
| E0005 | JANI       | BASHA    |   25 | 2026-02-17 | VJY     | PHARMA   |
| E0006 | SAI        | VARDAN   |   24 | 2024-03-18 | VSP     | TRAINING |
| E0007 | SAI        | KIRAN    |   32 | 2018-08-20 | BNG     | ADMIN    |
| E0008 | BALU       | SUBBU    |   40 | 2000-07-27 | DELHI   | SALES    |
+-------+------------+----------+------+------------+---------+----------+
8 rows in set (0.00 sec)

mysql> delete from employees where firstname='sai';
Query OK, 2 rows affected (0.08 sec)

mysql> select*from employees;
+-------+------------+----------+------+------------+---------+----------+
| EMPID | FIRSTNAME  | LASTNAME | AGE  | DOJ        | ADDRESS | DEPT     |
+-------+------------+----------+------+------------+---------+----------+
| E0001 | ARJUN      | SARKAR   |   27 | 2024-03-20 | HYD     | TRAINING |
| E0002 | NULL       | MAHESH   |   50 | 2026-03-03 | CHENNAI | IT       |
| E0003 | KATRINA    | LEONE    |   35 | 2000-03-20 | MUMBAI  | ACTING   |
| E0004 | SUMPURNESH | MAHESH   |   40 | 2016-09-10 | HYD     | ACTING   |
| E0005 | JANI       | BASHA    |   25 | 2026-02-17 | VJY     | PHARMA   |
| E0008 | BALU       | SUBBU    |   40 | 2000-07-27 | DELHI   | SALES    |
+-------+------------+----------+------+------------+---------+----------+
6 rows in set (0.00 sec)

mysql> DROP TABLE EMPLOYEES;
Query OK, 0 rows affected (0.10 sec)

mysql> DESC EMPLOYEES;
ERROR 1146 (42S02): Table 'pfs6.employees' doesn't exist
mysql> CREATE TABLE employees (
    ->     emp_id INT PRIMARY KEY,
    ->     emp_name VARCHAR(100),
    ->     department VARCHAR(50),
    ->     job_role VARCHAR(50),
    ->     salary DECIMAL(10,2),
    ->     joining_date DATE,
    ->     city VARCHAR(50)
    -> );
Query OK, 0 rows affected (0.04 sec)

mysql>
mysql>
mysql> INSERT INTO employees
    -> (emp_id, emp_name, department, job_role, salary, joining_date, city)
    -> VALUES
    -> (101, 'Ravi Kumar', 'IT', 'Developer', 45000, '2023-01-15', 'Vizag'),
    -> (102, 'Priya Sharma', 'HR', 'HR Manager', 55000, '2022-06-20', 'Hyderabad'),
    -> (103, 'Kiran Reddy', 'IT', 'Tester', 40000, '2023-03-10', 'Vizag'),
    -> (104, 'Sneha Rao', 'Finance', 'Accountant', 48000, '2021-11-25', 'Chennai'),
    -> (105, 'Arun Kumar', 'IT', 'Developer', 60000, '2020-08-18', 'Bangalore'),
    -> (106, 'Divya Reddy', 'HR', 'Recruiter', 35000, '2024-01-05', 'Vizag'),
    -> (107, 'Suresh Babu', 'Sales', 'Executive', 42000, '2022-09-12', 'Hyderabad'),
    -> (108, 'Anjali Devi', 'IT', 'Developer', 70000, '2019-05-30', 'Chennai'),
    -> (109, 'Mahesh Kumar', 'Sales', 'Manager', 65000, '2020-02-14', 'Bangalore'),
    -> (110, 'Lakshmi Rao', 'Finance', 'Analyst', 52000, '2023-07-22', 'Hyderabad');
Query OK, 10 rows affected (0.01 sec)
Records: 10  Duplicates: 0  Warnings: 0

mysql> SELECT*FROM EMPLOYEES;
+--------+--------------+------------+------------+----------+--------------+-----------+
| emp_id | emp_name     | department | job_role   | salary   | joining_date | city      |
+--------+--------------+------------+------------+----------+--------------+-----------+
|    101 | Ravi Kumar   | IT         | Developer  | 45000.00 | 2023-01-15   | Vizag     |
|    102 | Priya Sharma | HR         | HR Manager | 55000.00 | 2022-06-20   | Hyderabad |
|    103 | Kiran Reddy  | IT         | Tester     | 40000.00 | 2023-03-10   | Vizag     |
|    104 | Sneha Rao    | Finance    | Accountant | 48000.00 | 2021-11-25   | Chennai   |
|    105 | Arun Kumar   | IT         | Developer  | 60000.00 | 2020-08-18   | Bangalore |
|    106 | Divya Reddy  | HR         | Recruiter  | 35000.00 | 2024-01-05   | Vizag     |
|    107 | Suresh Babu  | Sales      | Executive  | 42000.00 | 2022-09-12   | Hyderabad |
|    108 | Anjali Devi  | IT         | Developer  | 70000.00 | 2019-05-30   | Chennai   |
|    109 | Mahesh Kumar | Sales      | Manager    | 65000.00 | 2020-02-14   | Bangalore |
|    110 | Lakshmi Rao  | Finance    | Analyst    | 52000.00 | 2023-07-22   | Hyderabad |
+--------+--------------+------------+------------+----------+--------------+-----------+
10 rows in set (0.00 sec)

mysql> ALTER TABLE EMPLOYEES ADD EMAIL VARCHAR(100);
Query OK, 0 rows affected (0.10 sec)
Records: 0  Duplicates: 0  Warnings: 0

mysql> SELECT*FROM EMPLOYEES;
+--------+--------------+------------+------------+----------+--------------+-----------+-------+
| emp_id | emp_name     | department | job_role   | salary   | joining_date | city      | EMAIL |
+--------+--------------+------------+------------+----------+--------------+-----------+-------+
|    101 | Ravi Kumar   | IT         | Developer  | 45000.00 | 2023-01-15   | Vizag     | NULL  |
|    102 | Priya Sharma | HR         | HR Manager | 55000.00 | 2022-06-20   | Hyderabad | NULL  |
|    103 | Kiran Reddy  | IT         | Tester     | 40000.00 | 2023-03-10   | Vizag     | NULL  |
|    104 | Sneha Rao    | Finance    | Accountant | 48000.00 | 2021-11-25   | Chennai   | NULL  |
|    105 | Arun Kumar   | IT         | Developer  | 60000.00 | 2020-08-18   | Bangalore | NULL  |
|    106 | Divya Reddy  | HR         | Recruiter  | 35000.00 | 2024-01-05   | Vizag     | NULL  |
|    107 | Suresh Babu  | Sales      | Executive  | 42000.00 | 2022-09-12   | Hyderabad | NULL  |
|    108 | Anjali Devi  | IT         | Developer  | 70000.00 | 2019-05-30   | Chennai   | NULL  |
|    109 | Mahesh Kumar | Sales      | Manager    | 65000.00 | 2020-02-14   | Bangalore | NULL  |
|    110 | Lakshmi Rao  | Finance    | Analyst    | 52000.00 | 2023-07-22   | Hyderabad | NULL  |
+--------+--------------+------------+------------+----------+--------------+-----------+-------+
10 rows in set (0.00 sec)

mysql> ALTER TABLE EMPLOYEES ADD PHONE VARCHAR(15);
Query OK, 0 rows affected (0.10 sec)
Records: 0  Duplicates: 0  Warnings: 0

mysql> SELECT*FROM EMPLOYEES;
+--------+--------------+------------+------------+----------+--------------+-----------+-------+-------+
| emp_id | emp_name     | department | job_role   | salary   | joining_date | city      | EMAIL | PHONE |
+--------+--------------+------------+------------+----------+--------------+-----------+-------+-------+
|    101 | Ravi Kumar   | IT         | Developer  | 45000.00 | 2023-01-15   | Vizag     | NULL  | NULL  |
|    102 | Priya Sharma | HR         | HR Manager | 55000.00 | 2022-06-20   | Hyderabad | NULL  | NULL  |
|    103 | Kiran Reddy  | IT         | Tester     | 40000.00 | 2023-03-10   | Vizag     | NULL  | NULL  |
|    104 | Sneha Rao    | Finance    | Accountant | 48000.00 | 2021-11-25   | Chennai   | NULL  | NULL  |
|    105 | Arun Kumar   | IT         | Developer  | 60000.00 | 2020-08-18   | Bangalore | NULL  | NULL  |
|    106 | Divya Reddy  | HR         | Recruiter  | 35000.00 | 2024-01-05   | Vizag     | NULL  | NULL  |
|    107 | Suresh Babu  | Sales      | Executive  | 42000.00 | 2022-09-12   | Hyderabad | NULL  | NULL  |
|    108 | Anjali Devi  | IT         | Developer  | 70000.00 | 2019-05-30   | Chennai   | NULL  | NULL  |
|    109 | Mahesh Kumar | Sales      | Manager    | 65000.00 | 2020-02-14   | Bangalore | NULL  | NULL  |
|    110 | Lakshmi Rao  | Finance    | Analyst    | 52000.00 | 2023-07-22   | Hyderabad | NULL  | NULL  |
+--------+--------------+------------+------------+----------+--------------+-----------+-------+-------+
10 rows in set (0.00 sec)

mysql> UPDATE EMPLOYEES SET CITY VARCHAR(100) WHERE VARCHAR(50);
ERROR 1064 (42000): You have an error in your SQL syntax; check the manual that corresponds to your MySQL server version for the right syntax to use near 'VARCHAR(100) WHERE VARCHAR(50)' at line 1
mysql> ^C
mysql> ALTER TABLE EMPLOYEES JOB_ROLE RENAME TO DESIGNATION;
ERROR 1064 (42000): You have an error in your SQL syntax; check the manual that corresponds to your MySQL server version for the right syntax to use near 'JOB_ROLE RENAME TO DESIGNATION' at line 1
mysql> ^C
mysql>